{
  "$schema": "https://json-schema.org/draft/2020-12/schema",
  "$id": "https://raw.githubusercontent.com/Lueken/the-almanac-illuminated/main/docs/guide-pack.schema.json",
  "title": "The Almanac: Illuminated guide pack",
  "description": "A chapter for The Almanac. See docs/SCHEMA.md, which is canonical; this schema follows it.",
  "type": "object",
  "required": [
    "schemaVersion",
    "id",
    "title",
    "sections"
  ],
  "additionalProperties": false,
  "properties": {
    "$schema": {
      "type": "string"
    },
    "schemaVersion": {
      "type": "integer",
      "minimum": 1,
      "description": "The format version this guide targets. Unrelated to the mod's own version."
    },
    "id": {
      "type": "string",
      "minLength": 1,
      "description": "Unique chapter id. Namespace it with your author domain, e.g. venah:fieldwright. Internal links resolve to it."
    },
    "gate": {
      "type": "string",
      "description": "The modid required for the chapter to appear. Omit to always show (front matter)."
    },
    "title": {
      "$ref": "#/$defs/localizableString",
      "description": "The chapter title. A literal or a #langkey."
    },
    "tabLabel": {
      "type": "string",
      "description": "Short label for this chapter's tab, when the title is the wrong words for a narrow slip. Falls back to title. Applies wherever the chapter becomes a tab: the overview slot, a ribbonTab, or the pinned band. Supports the '#langkey' convention."
    },
    "subtitle": {
      "$ref": "#/$defs/localizableString",
      "description": "One line under the title."
    },
    "byline": {
      "$ref": "#/$defs/localizableString",
      "description": "Attribution line, e.g. 'set down by Venah'. The author's-hand seal draws its initial from here."
    },
    "icon": {
      "type": "string",
      "description": "An itemstack code or texture path for the chapter's index icon."
    },
    "accentColor": {
      "$ref": "#/$defs/hexColor",
      "description": "The chapter's identity color, used on drop-caps and rules. Defaults to a parchment neutral."
    },
    "order": {
      "type": "integer",
      "description": "Gate-less (front matter) chapters only. Sort position among front matter, lower first. Ignored on gated chapters."
    },
    "overview": {
      "type": "boolean",
      "description": "Gate-less chapters only. Pins this chapter first in the front matter and makes it the book's default landing page. The server overview opts in here."
    },
    "contents": {
      "type": "boolean",
      "description": "Marks this chapter as the contents/index page. It is kept out of the chapter reading flow and tabs, and reached through the Contents tab instead."
    },
    "ribbonTab": {
      "type": "boolean",
      "description": "Pins this chapter as its own left-ribbon tab, pulled out of the A-Z reading flow. Grouped with the computed tabs and sorted among them by order."
    },
    "pinned": {
      "type": "boolean",
      "description": "Lifts this chapter into the pinned band: named tabs at the top of the right thumb index, ahead of the letters, sorted by order then id. Allowed on gated chapters."
    },
    "revealedBy": {
      "type": "string",
      "pattern": "^[^:\\s]+:[^:\\s]+",
      "description": "Hides the WHOLE chapter, tab included, until the host mod reports this knowledge key. For a chapter whose title would spoil the one before it. Degrades open: no provider registered for the namespace means the chapter is visible."
    },
    "sections": {
      "type": "array",
      "minItems": 1,
      "items": {
        "$ref": "#/$defs/section"
      },
      "description": "The ordered content. The engine flows sections across the spread."
    }
  },
  "allOf": [
    {
      "if": {
        "required": [
          "overview"
        ],
        "properties": {
          "overview": {
            "const": true
          }
        }
      },
      "then": {
        "not": {
          "required": [
            "gate"
          ]
        },
        "description": "overview is gate-less only."
      }
    }
  ],
  "$defs": {
    "localizableString": {
      "type": "string",
      "description": "A literal, or a #langkey resolved through the game's lang system. Double a leading # to escape it."
    },
    "hexColor": {
      "type": "string",
      "pattern": "^#[0-9a-fA-F]{6}$"
    },
    "section": {
      "type": "object",
      "required": [
        "blocks"
      ],
      "additionalProperties": false,
      "properties": {
        "id": {
          "type": "string",
          "description": "Stable anchor for internal links. Never shown. Must not change once links rely on it."
        },
        "title": {
          "$ref": "#/$defs/localizableString",
          "description": "Section title. Omit for a continuation section."
        },
        "pageBreakBefore": {
          "type": "boolean",
          "description": "Start this section on a fresh page (the left page of the next spread)."
        },
        "keepTogether": {
          "type": "boolean",
          "description": "Do not split this section across a page boundary. It moves whole to the next page if it does not fit."
        },
        "revealedBy": {
          "type": "string",
          "pattern": "^[^:\\s]+:[^:\\s]+",
          "description": "The section's blocks render only when the registered reveal provider for that namespace says the key is earned. No provider registered means always visible."
        },
        "hint": {
          "$ref": "#/$defs/localizableString",
          "description": "Placeholder line shown while the section is unrevealed. Falls back to the shipped default."
        },
        "whenChapterComplete": {
          "type": "boolean",
          "description": "Render this section only once every reveal key the chapter references (its own revealedBy and every section's) has been earned. Unlike revealedBy, an incomplete chapter shows nothing of it: no title, no hint line. A key whose namespace has no registered provider counts as unearned here. A chapter that references no reveal keys is complete by default."
        },
        "blocks": {
          "type": "array",
          "minItems": 1,
          "items": {
            "$ref": "#/$defs/block"
          }
        }
      }
    },
    "block": {
      "type": "object",
      "required": [
        "type"
      ],
      "additionalProperties": false,
      "properties": {
        "type": {
          "enum": [
            "heading",
            "paragraph",
            "dropcap",
            "steps",
            "materials",
            "recipe",
            "callout",
            "quest",
            "figure",
            "ledger",
            "divider",
            "link",
            "contents",
            "table"
          ]
        },
        "requires": {
          "type": "array",
          "items": {
            "type": "string"
          },
          "description": "Per-block gating. The block renders only when every listed mod is loaded."
        },
        "text": {
          "$ref": "#/$defs/localizableString"
        },
        "level": {
          "type": "integer",
          "minimum": 1,
          "maximum": 3
        },
        "dropcap": {
          "type": "boolean"
        },
        "letter": {
          "type": "string"
        },
        "items": {
          "type": "array"
        },
        "ordered": {
          "type": "boolean"
        },
        "recipe": {
          "type": "string"
        },
        "output": {
          "type": "string"
        },
        "variant": {
          "enum": [
            "author",
            "tip",
            "warning",
            "lore"
          ]
        },
        "icon": {
          "type": "string"
        },
        "questId": {
          "type": "string"
        },
        "image": {
          "type": "string"
        },
        "caption": {
          "$ref": "#/$defs/localizableString"
        },
        "align": {
          "enum": [
            "left",
            "right",
            "full"
          ]
        },
        "entries": {
          "type": "array",
          "items": {
            "$ref": "#/$defs/localizableString"
          }
        },
        "ornament": {
          "type": "string"
        },
        "to": {
          "type": "string"
        },
        "include": {
          "enum": [
            "added",
            "all"
          ],
          "description": "contents block only. Which mods to list: 'added' (default) hides the base game; 'all' lists every loaded mod."
        }
      },
      "allOf": [
        {
          "if": {
            "properties": {
              "type": {
                "const": "heading"
              }
            }
          },
          "then": {
            "required": [
              "text"
            ]
          }
        },
        {
          "if": {
            "properties": {
              "type": {
                "const": "paragraph"
              }
            }
          },
          "then": {
            "required": [
              "text"
            ]
          }
        },
        {
          "if": {
            "properties": {
              "type": {
                "const": "dropcap"
              }
            }
          },
          "then": {
            "required": [
              "letter"
            ]
          }
        },
        {
          "if": {
            "properties": {
              "type": {
                "const": "steps"
              }
            }
          },
          "then": {
            "required": [
              "items"
            ],
            "properties": {
              "items": {
                "type": "array",
                "items": {
                  "$ref": "#/$defs/localizableString"
                }
              }
            }
          }
        },
        {
          "if": {
            "properties": {
              "type": {
                "const": "materials"
              }
            }
          },
          "then": {
            "required": [
              "items"
            ],
            "properties": {
              "items": {
                "type": "array",
                "items": {
                  "$ref": "#/$defs/materialItem"
                }
              }
            }
          }
        },
        {
          "if": {
            "properties": {
              "type": {
                "const": "recipe"
              }
            }
          },
          "then": {
            "oneOf": [
              {
                "required": [
                  "recipe"
                ],
                "not": {
                  "required": [
                    "output"
                  ]
                }
              },
              {
                "required": [
                  "output"
                ],
                "not": {
                  "required": [
                    "recipe"
                  ]
                }
              }
            ]
          }
        },
        {
          "if": {
            "properties": {
              "type": {
                "const": "callout"
              }
            }
          },
          "then": {
            "required": [
              "variant",
              "text"
            ]
          }
        },
        {
          "if": {
            "properties": {
              "type": {
                "const": "quest"
              }
            }
          },
          "then": {
            "required": [
              "items"
            ],
            "properties": {
              "items": {
                "type": "array",
                "items": {
                  "$ref": "#/$defs/questItem"
                }
              }
            }
          }
        },
        {
          "if": {
            "properties": {
              "type": {
                "const": "figure"
              }
            }
          },
          "then": {
            "required": [
              "image"
            ]
          }
        },
        {
          "if": {
            "properties": {
              "type": {
                "const": "ledger"
              }
            }
          },
          "then": {
            "required": [
              "entries"
            ]
          }
        },
        {
          "if": {
            "properties": {
              "type": {
                "const": "link"
              }
            }
          },
          "then": {
            "required": [
              "to",
              "text"
            ]
          }
        }
      ]
    },
    "materialItem": {
      "type": "object",
      "required": [
        "code"
      ],
      "additionalProperties": false,
      "properties": {
        "code": {
          "type": "string",
          "description": "An item or block code, e.g. game:ingot-iron."
        },
        "label": {
          "$ref": "#/$defs/localizableString"
        },
        "count": {
          "type": "integer",
          "minimum": 1
        }
      }
    },
    "questItem": {
      "type": "object",
      "required": [
        "text"
      ],
      "additionalProperties": false,
      "properties": {
        "text": {
          "$ref": "#/$defs/localizableString"
        },
        "done": {
          "type": "boolean"
        },
        "doneWhen": {
          "type": "string",
          "pattern": "^[^:\\s]+:[^:\\s]+",
          "description": "Reveal key that ticks this item off once earned. Read from the same providers revealedBy uses, but strict: a key whose namespace has no registered provider leaves the box open. Combines with done as an OR."
        }
      }
    }
  }
}
