{
  "$schema": "https://raw.githubusercontent.com/Lueken/the-almanac-illuminated/main/docs/guide-pack.schema.json",
  "schemaVersion": 1,
  "id": "almanacilluminated:welcome",
  "contents": true,
  "title": "Index",
  "subtitle": "How this book works",
  "byline": "set down by Venah",
  "accentColor": "#7a5a2e",
  "sections": [
    {
      "id": "what-this-is",
      "title": "What this is",
      "blocks": [
        {
          "type": "paragraph",
          "dropcap": true,
          "text": "This book gathers guide chapters from the mods you have loaded. A chapter appears only when its mod is present, so your Almanac always matches your modlist."
        },
        {
          "type": "steps",
          "items": [
            "Press Alt+J to open the book.",
            "Pick a mod from the contents to read its chapter.",
            "Use Back to return, or Contents to come home."
          ]
        }
      ]
    },
    {
      "id": "your-almanac",
      "title": "Your Almanac",
      "blocks": [
        {
          "type": "paragraph",
          "text": "Every mod you have loaded is listed below. The ones with a guide are links. The rest have no chapter yet."
        },
        {
          "type": "contents"
        }
      ]
    },
    {
      "id": "for-authors",
      "title": "For mod authors",
      "blocks": [
        {
          "type": "paragraph",
          "text": "Write a chapter as plain JSON and ship it in your own mod. The format is documented in the repository, with worked examples for figures, recipes, and callouts. The book owns layout, fonts, and gating. You bring the content."
        },
        {
          "type": "callout",
          "variant": "author",
          "text": "Keep chapters short. A reader opens the book mid-task and wants the one thing they came for, not an essay."
        }
      ]
    }
  ]
}
